{
  "schemaVersion": 1,
  "projectId": "cbddc3b0-12a6-48e0-a141-631f8f793c03",
  "title": "Mac Utilities",
  "tiers": [
    { "id": "m1", "label": "Must Have", "color": "#007AFF", "order": 0, "itemIds": ["app1"] },
    { "id": "m2", "label": "Recommended", "color": "#34C759", "order": 1, "itemIds": ["app2"] }
  ],
  "items": {
    "app1": { "id": "app1", "title": "Magnet", "attributes": { "bundleId": "com.crowdcafe.windowmagnet", "priceUSD": 7.99 }, "media": [ { "id": "app1-icon", "kind": "image", "uri": "https://example.com/magnet.png", "mime": "image/png" } ], "rating": 95 },
    "app2": { "id": "app2", "title": "TextMate", "attributes": { "bundleId": "com.macromates.TextMate", "priceUSD": 0 }, "media": [ { "id": "app2-icon", "kind": "image", "uri": "https://example.com/textmate.png", "mime": "image/png" } ], "rating": 85 }
  },
  "overrides": { "app2": { "notes": "Open source and free." } },
  "audit": { "createdAt": "2025-09-15T17:40:01.534Z", "updatedAt": "2025-09-15T17:40:01.534Z" }
}