{
  "schemaVersion": 1,
  "projectId": "bbbd220d-4265-44e4-b64f-d0bb03ea724a",
  "title": "Favorite Video Games",
  "tiers": [
    { "id": "g1", "label": "S", "color": "#FFD700", "order": 0, "itemIds": ["g1","g2"] },
    { "id": "g2", "label": "A", "color": "#C0C0C0", "order": 1, "itemIds": ["g3"] }
  ],
  "items": {
    "g1": { "id": "g1", "title": "Elden Ring", "attributes": { "platforms": ["PS5","PC"], "releaseYear": 2022 }, "media": [ { "id": "g1-cover", "kind": "image", "uri": "https://example.com/elden.jpg", "mime": "image/jpeg" }, { "id": "g1-video", "kind": "video", "uri": "https://example.com/elden_trailer.mp4", "mime": "video/mp4", "durationMs": 120000 } ], "rating": 98 },
    "g2": { "id": "g2", "title": "Breath of the Wild", "attributes": { "platforms": ["Switch"], "releaseYear": 2017 }, "media": [ { "id": "g2-cover", "kind": "image", "uri": "https://example.com/botw.jpg", "mime": "image/jpeg" } ], "rating": 96 },
    "g3": { "id": "g3", "title": "Cyberpunk 2077", "attributes": { "platforms": ["PC","PS5"], "releaseYear": 2020 }, "media": [ { "id": "g3-cover", "kind": "image", "uri": "https://example.com/cp2077.jpg", "mime": "image/jpeg" } ], "rating": 80 }
  },
  "overrides": { "g3": { "notes": "Improved after patches", "rating": 85 } },
  "audit": { "createdAt": "2025-09-15T17:39:31.574Z", "updatedAt": "2025-09-15T17:39:31.574Z", "createdBy": "dev1" }
}